{
  "protocol": "astramem-sync@1",
  "device_id": "device-laptop-01",
  "workspace_id": "ws-astragenie",
  "cursor": 0,
  "events": [
    {
      "seq": 1,
      "event_type": "create",
      "atom_id": "00000000-0000-4000-8000-000000000001",
      "payload_json": null,
      "content_hash": "a3f5c1e9b2d4e6f8017b3c5d7e9f1a3b5c7d9e1f3a5b7c9d1e3f5a7b9c1d3e5f",
      "created_at": 1780358400000
    }
  ]
}
